{
  "areas": [],
  "coordinate_frame": "map",
  "map_id": "cdfdfba7-fd0a-4eaf-88ab-aa8608961689",
  "metadata": {
    "formal_consumers": {
      "controller": "trajectory/waypoints.yaml",
      "global_planner": "roadnet/topology.json",
      "task_manager": "semantics/task_points.json"
    },
    "source_metadata": {
      "curve_id_counter": 0,
      "editor_schema_version": "2.1",
      "line_id_counter": 0,
      "region_id_counter": 0,
      "region_name_counter": 0,
      "topology_normalized_at": "2026-06-11T01:09:59.632Z"
    },
    "source_project_id": "f9711a93-304a-4ff2-9f9a-b1aa96070e99"
  },
  "nodes": [
    {
      "id": "N-001",
      "pose": {
        "x": -18.636,
        "y": 4.996,
        "yaw": 0.0
      },
      "properties": {
        "connectedPathIds": [
          "C-001",
          "C-008"
        ],
        "metadata": {
          "source": "editor_snap"
        },
        "snap_radius": 0.15
      },
      "source_node_id": "N-001",
      "type": "normal"
    },
    {
      "id": "N-016",
      "pose": {
        "x": -12.831,
        "y": 2.681,
        "yaw": 0.0
      },
      "properties": {
        "connectedPathIds": [
          "C-001",
          "C-017",
          "C-018"
        ],
        "metadata": {
          "originalPathId": "C-001",
          "sOnPath": 5.1110331328148435,
          "source": "path_interior_split"
        },
        "snap_radius": 0.15
      },
      "source_node_id": "N-016",
      "type": "intersection"
    },
    {
      "id": "N-012",
      "pose": {
        "x": -7.321,
        "y": 1.379,
        "yaw": 0.0
      },
      "properties": {
        "connectedPathIds": [
          "C-012",
          "C-013",
          "C-017"
        ],
        "metadata": {
          "originalPathId": "C-001",
          "sOnPath": 11.909694435628564,
          "source": "path_interior_split"
        },
        "snap_radius": 0.15
      },
      "source_node_id": "N-012",
      "type": "intersection"
    },
    {
      "id": "N-002",
      "pose": {
        "x": 6.804,
        "y": 0.192,
        "yaw": 0.0
      },
      "properties": {
        "connectedPathIds": [
          "C-002",
          "C-012"
        ],
        "metadata": {
          "source": "editor_snap"
        },
        "snap_radius": 0.15
      },
      "source_node_id": "N-002",
      "type": "normal"
    },
    {
      "id": "N-008",
      "pose": {
        "x": 9.805,
        "y": 2.241,
        "yaw": 0.0
      },
      "properties": {
        "connectedPathIds": [
          "C-002",
          "C-006",
          "C-007"
        ],
        "metadata": {
          "originalPathId": "C-002",
          "sOnPath": 4.193964012465775,
          "source": "path_interior_split"
        },
        "snap_radius": 0.15
      },
      "source_node_id": "N-008",
      "type": "intersection"
    },
    {
      "id": "N-003",
      "pose": {
        "x": 8.915,
        "y": 5.558,
        "yaw": 0.0
      },
      "properties": {
        "connectedPathIds": [
          "C-003",
          "C-006"
        ],
        "metadata": {
          "source": "editor_snap"
        },
        "snap_radius": 0.15
      },
      "source_node_id": "N-003",
      "type": "normal"
    },
    {
      "id": "N-019",
      "pose": {
        "x": 7.118,
        "y": 6.855,
        "yaw": 0.0
      },
      "properties": {
        "connectedPathIds": [
          "C-003",
          "C-022"
        ],
        "metadata": {
          "originalPathId": "C-003",
          "sOnPath": 1.2835424451495407,
          "source": "path_interior_split"
        },
        "snap_radius": 0.15
      },
      "source_node_id": "N-019",
      "type": "intersection"
    },
    {
      "id": "N-017",
      "pose": {
        "x": 4.452,
        "y": 8.819,
        "yaw": 0.0
      },
      "properties": {
        "connectedPathIds": [
          "C-019",
          "C-020",
          "C-022"
        ],
        "metadata": {
          "originalPathId": "C-003",
          "sOnPath": 5.549994974771319,
          "source": "path_interior_split"
        },
        "snap_radius": 0.15
      },
      "source_node_id": "N-017",
      "type": "intersection"
    },
    {
      "id": "N-025",
      "pose": {
        "x": 1.16,
        "y": 10.323,
        "yaw": 0.0
      },
      "properties": {
        "connectedPathIds": [
          "C-019",
          "C-021"
        ],
        "metadata": {
          "originalPathId": "C-019",
          "sOnPath": 3.6201395321238694,
          "source": "path_interior_split"
        },
        "snap_radius": 0.15
      },
      "source_node_id": "N-025",
      "type": "intersection"
    },
    {
      "id": "N-010",
      "pose": {
        "x": -3.161,
        "y": 11.772,
        "yaw": 0.0
      },
      "properties": {
        "connectedPathIds": [
          "C-010",
          "C-011",
          "C-021"
        ],
        "metadata": {
          "originalPathId": "C-003",
          "sOnPath": 13.779137582633126,
          "source": "path_interior_split"
        },
        "snap_radius": 0.15
      },
      "source_node_id": "N-010",
      "type": "intersection"
    },
    {
      "id": "N-005",
      "pose": {
        "x": -5.342,
        "y": 12.322,
        "yaw": 0.0
      },
      "properties": {
        "connectedPathIds": [
          "C-004",
          "C-010"
        ],
        "metadata": {
          "source": "editor_snap"
        },
        "snap_radius": 0.15
      },
      "source_node_id": "N-005",
      "type": "normal"
    },
    {
      "id": "N-013",
      "pose": {
        "x": -13.027,
        "y": 12.984,
        "yaw": 0.0
      },
      "properties": {
        "connectedPathIds": [
          "C-004",
          "C-014",
          "C-016"
        ],
        "metadata": {
          "originalPathId": "C-004",
          "sOnPath": 7.7692734228395555,
          "source": "path_interior_split"
        },
        "snap_radius": 0.15
      },
      "source_node_id": "N-013",
      "type": "intersection"
    },
    {
      "id": "N-006",
      "pose": {
        "x": -17.218,
        "y": 11.744,
        "yaw": 0.0
      },
      "properties": {
        "connectedPathIds": [
          "C-005",
          "C-014"
        ],
        "metadata": {
          "source": "editor_snap"
        },
        "snap_radius": 0.15
      },
      "source_node_id": "N-006",
      "type": "normal"
    },
    {
      "id": "N-009",
      "pose": {
        "x": -19.038,
        "y": 10.493,
        "yaw": 0.0
      },
      "properties": {
        "connectedPathIds": [
          "C-005",
          "C-008",
          "C-009"
        ],
        "metadata": {
          "originalPathId": "C-005",
          "sOnPath": 2.7081818172672687,
          "source": "path_interior_split"
        },
        "snap_radius": 0.15
      },
      "source_node_id": "N-009",
      "type": "intersection"
    },
    {
      "id": "N-004",
      "pose": {
        "x": -14.356,
        "y": 7.813,
        "yaw": 0.0
      },
      "properties": {
        "connectedPathIds": [
          "C-015",
          "L-001"
        ],
        "metadata": {
          "source": "editor_snap"
        },
        "snap_radius": 0.15
      },
      "source_node_id": "N-004",
      "type": "normal"
    },
    {
      "id": "N-015",
      "pose": {
        "x": -13.169,
        "y": 7.597,
        "yaw": 0.0
      },
      "properties": {
        "connectedPathIds": [
          "C-018",
          "L-001",
          "L-003"
        ],
        "metadata": {
          "originalPathId": "L-001",
          "sOnPath": 1.2064590477553787,
          "source": "path_interior_split"
        },
        "snap_radius": 0.15
      },
      "source_node_id": "N-015",
      "type": "intersection"
    },
    {
      "id": "N-011",
      "pose": {
        "x": -4.897,
        "y": 6.088,
        "yaw": 0.0
      },
      "properties": {
        "connectedPathIds": [
          "C-011",
          "C-013",
          "L-002",
          "L-003"
        ],
        "metadata": {
          "originalPathId": "L-001",
          "sOnPath": 9.91357630425356,
          "source": "path_interior_split"
        },
        "snap_radius": 0.15
      },
      "source_node_id": "N-011",
      "type": "intersection"
    },
    {
      "id": "N-018",
      "pose": {
        "x": -1.376,
        "y": 5.116,
        "yaw": 0.0
      },
      "properties": {
        "connectedPathIds": [
          "C-020",
          "L-002",
          "L-004"
        ],
        "metadata": {
          "originalPathId": "L-002",
          "sOnPath": 2.8398657329913184,
          "source": "path_interior_split"
        },
        "snap_radius": 0.15
      },
      "source_node_id": "N-018",
      "type": "intersection"
    },
    {
      "id": "N-007",
      "pose": {
        "x": 1.248,
        "y": 4.363,
        "yaw": 0.0
      },
      "properties": {
        "connectedPathIds": [
          "C-007",
          "L-004"
        ],
        "metadata": {
          "source": "editor_snap"
        },
        "snap_radius": 0.15
      },
      "source_node_id": "N-007",
      "type": "normal"
    },
    {
      "id": "N-014",
      "pose": {
        "x": -16.669,
        "y": 8.348,
        "yaw": 0.0
      },
      "properties": {
        "connectedPathIds": [
          "C-009",
          "C-015",
          "C-016"
        ],
        "metadata": {
          "originalPathId": "C-009",
          "sOnPath": 3.5413768969249273,
          "source": "path_interior_split"
        },
        "snap_radius": 0.15
      },
      "source_node_id": "N-014",
      "type": "intersection"
    }
  ],
  "paths": [
    {
      "behavior_tags": [],
      "constraints": {
        "allow_reverse": false,
        "allow_stop": true,
        "max_curvature_abs": 0.35,
        "min_width_m": 0.0
      },
      "control_points": [
        {
          "x": -18.636,
          "y": 4.996
        },
        {
          "x": -17.399,
          "y": 4.381
        },